{
  "schema_version": "1.0",
  "recipe_id": "fullframe-source-subtitle-blur-v1",
  "title": "Full-frame source recut with tracked subtitle blur",
  "status": "accepted-pattern",
  "lane": "source-transformation",
  "best_for": [
    "recomposing an approved vertical villa or tour video while preserving the complete original frame",
    "removing burned-in titles and subtitles from selected human-free scenes and replacing them with clean editorial copy",
    "music-led property or destination reels that do not need narration"
  ],
  "avoid_when": [
    "the source aspect ratio does not match the delivery and reframing is required",
    "a presenter, face, or reflection remains in every usable interval",
    "source text crosses a moving subject and cannot be covered with a narrow tracked mask",
    "the combined blur masks cover more than 20 percent of a frame or obscure the principal architecture",
    "true object removal or scene reconstruction is required"
  ],
  "source_contract": [
    "Use only owner-approved source video and record its URL and SHA-256",
    "Inspect the complete source at intervals no wider than 0.5 seconds, plus exact first, last, and transition frames; one midpoint per shot is insufficient",
    "Select only human-free intervals and record a frame manifest proving that people, faces, and reflections are absent throughout each interval",
    "Map each burned-in title and subtitle region per shot; reusing one global mask across shot classes is forbidden",
    "Track moving text with time-bounded or keyframed masks; if any glyph escapes a fixed mask, trim the shot or reject this route",
    "Measure the union of masked pixels per frame without double-counting overlaps and reject the route when it exceeds 20 percent of the delivery frame",
    "Use licensed music and remove all original source audio"
  ],
  "creative_contract": [
    "Scale the complete original 9:16 frame directly to 1080x1920 without cropping, background fill, or invented scenery",
    "Use narrow per-shot tracked blur masks over only the original title and subtitle regions",
    "Prefer excluding a shot or using precise cleanup over hiding a central subject with blur",
    "Add concise replacement subtitles on a readable editorial card inside mobile-safe margins",
    "Build a smooth multi-shot sequence from approximately three-second scenes with short dissolves and keep time remapping between 0.8x and 1.35x",
    "Limit copy to visible property facts and mood; do not invent facilities, price, availability, or performance claims",
    "Use vibe music only unless the requested recipe explicitly calls for narration"
  ],
  "qa_contract": [
    "Verify source_frame_crop is false and the full original 9:16 frame is visible",
    "Review source and final frames at intervals no wider than 0.5 seconds, plus the exact first, last, and transition frames of every shot",
    "Record the per-frame union mask ratio and reject any frame above 20 percent or any mask that covers the principal subject",
    "Reject any visible presenter, face, reflection, original title, or original subtitle",
    "Run full-playback review plus dense CRV review after the final encode; sparse midpoint sampling cannot satisfy this gate",
    "Keep creative acceptance pending after render success; only a reviewer distinct from the producing worker may promote the candidate",
    "Require 1080x1920 H.264 yuv420p at 30 fps with AAC audio and no black segments",
    "Keep music near -18 to -14 LUFS with no clipping"
  ],
  "hard_rejections": [
    "cropped foreground or blurred background fill described as full-frame preservation",
    "a broad blur block that hides meaningful room or architectural detail",
    "multiple blur bands that technically hide text but dominate the composition",
    "original title or subtitle characters visible outside the tracked mask",
    "a presenter, face, or reflection retained in a selected shot",
    "original speech or source audio retained",
    "generated facilities or unverified property claims"
  ],
  "canonical_artifacts": [
    {
      "repo": "openmontage",
      "path": "docs/recipes/patterns/fullframe-source-subtitle-blur-v1.json",
      "role": "portable recipe contract",
      "tracked": true
    },
    {
      "repo": "openmontage",
      "path": "projects/sun-samui-villa-narrated-dual-poc/build_fullframe_blurred_subtitles.py",
      "role": "deterministic full-frame builder",
      "tracked": false
    },
    {
      "repo": "openmontage",
      "path": "projects/sun-samui-villa-narrated-dual-poc/artifacts/REPRODUCTION_BLUEPRINT.md",
      "role": "source selection, blur-mask, composition, and safety contract",
      "tracked": false
    },
    {
      "repo": "openmontage",
      "path": "projects/sun-samui-villa-narrated-dual-poc/artifacts/QA_REPORT.json",
      "role": "accepted technical and visual QA evidence",
      "tracked": false
    }
  ],
  "reproduce": {
    "command": ".venv/bin/python projects/sun-samui-villa-narrated-dual-poc/build_fullframe_blurred_subtitles.py",
    "working_repo": "openmontage",
    "paid_calls": false,
    "notes": [
      "Create a new dated project or output; never overwrite the accepted proof",
      "Rebuild the interval and per-shot mask map for every new source",
      "Preserve failed corrections as evidence and never overwrite the accepted baseline",
      "The sibling narrated and cropped outputs are alternatives, not this full-frame recipe"
    ]
  },
  "proof": {
    "disposition": "Owner accepted the corrected full-frame, subtitle-blurred, music-led result as a reusable pattern on 2026-07-14",
    "qa": "PASS: 26.9 seconds, 1080x1920 H.264 yuv420p at 30 fps, AAC stereo, -15.4 LUFS, -2.5 dBFS true peak, no black segments, no humans, no source text, full original frame preserved",
    "output_repo": "openmontage",
    "output_path": "projects/sun-samui-villa-narrated-dual-poc/outputs/sun-samui-fullframe-blurred-subtitles-v1.mp4",
    "output_sha256": "341932e2807098d466d39da523549145588b51e89ec9448f603484ed8873986e"
  },
  "variants": [
    {
      "blueprint_id": "fullframe-music-recaption-v1",
      "status": "accepted",
      "builder": "build_fullframe_blurred_subtitles.py",
      "distinction": "Preserves the complete source frame; tracked blur removes source text; replacement subtitles and music provide the new edit."
    }
  ]
}
